{
  "schemaVersion": "1",
  "capability": "rbac",
  "target": "nestjs",
  "version": "0.2.0",
  "description": "Autorisation RBAC NestJS : rôles, permissions fines, contexte d'autorisation par requête, guards globaux ordonnés après l'authentification et résumé d'autorisation de l'utilisateur courant (ADR-006). Composée par-dessus base + auth.",
  "files": [
    {
      "source": "files/src/authorization",
      "destination": "src/authorization"
    },
    {
      "source": "files/src/roles",
      "destination": "src/roles"
    },
    {
      "source": "files/src/permissions",
      "destination": "src/permissions"
    },
    {
      "source": "files/src/rbac",
      "destination": "src/rbac"
    },
    {
      "source": "files/prisma/migrations/20260719000200_rbac_init",
      "destination": "prisma/migrations/20260719000200_rbac_init"
    },
    {
      "source": "files/test/auth-rbac.e2e-spec.ts",
      "destination": "test/auth-rbac.e2e-spec.ts"
    },
    {
      "source": "files/prisma/seed/rbac.seed.ts",
      "destination": "prisma/seed/rbac.seed.ts"
    }
  ],
  "dependencies": {},
  "environment": [],
  "integrations": [
    {
      "kind": "nestjs.module",
      "importPath": "../authorization/authorization.module",
      "symbol": "AuthorizationModule"
    },
    {
      "kind": "nestjs.global-guard",
      "importPath": "../roles/guards/roles.guard",
      "symbol": "RolesGuard",
      "order": 20
    },
    {
      "kind": "nestjs.global-guard",
      "importPath": "../permissions/guards/permissions.guard",
      "symbol": "PermissionsGuard",
      "order": 30
    },
    {
      "kind": "nestjs.prisma-schema",
      "source": "fragments/rbac.prisma.json"
    },
    {
      "kind": "nestjs.prisma-seed",
      "importPath": "./rbac.seed",
      "symbol": "seedRbac",
      "order": 20
    }
  ],
  "verification": [],
  "contract": {
    "openapiOperations": [
      "auth_getAuthorization"
    ]
  }
}
