{
  "schemaVersion": "1",
  "capability": "files",
  "target": "nextjs",
  "version": "0.2.0",
  "description": "Files V1 Next.js : BFF same-origin, pages protégées, upload/list/detail/download/delete et actions admin gouvernées.",
  "files": [
    {
      "source": "files/src/features/files",
      "destination": "src/features/files"
    },
    {
      "source": "files/src/app/api/files",
      "destination": "src/app/api/files"
    },
    {
      "source": "files/src/app/(protected)/protected/files",
      "destination": "src/app/(protected)/protected/files"
    },
    {
      "source": "files/test",
      "destination": "test"
    },
    {
      "source": "files/e2e/files.spec.ts",
      "destination": "e2e/files.spec.ts"
    },
    {
      "source": "files/e2e/helpers-full-composition.ts",
      "destination": "e2e/files-helpers.ts"
    }
  ],
  "dependencies": {
    "dependencies": {
      "@hookform/resolvers": "5.4.0",
      "react-hook-form": "^7.81.0",
      "zod": "^4.4.3"
    }
  },
  "environment": [],
  "integrations": [
    {
      "kind": "nextjs.dashboard-nav-link",
      "href": "/protected/files",
      "label": "Fichiers",
      "order": 20
    },
    {
      "kind": "nextjs.dashboard-nav-link",
      "href": "/protected/files/upload",
      "label": "Envoyer un fichier",
      "order": 30
    }
  ],
  "verification": [
    [
      "npm",
      "run",
      "test"
    ]
  ]
}
